{
  "schema_version": "0.3.0",
  "paper_id": "brooks_2016_passrank",
  "bibliographic": {
    "title": "Developing a Data-Driven Player Ranking in Soccer Using Predictive Model Weights",
    "authors": [
      "Joel Brooks",
      "Matthew Kerr",
      "John Guttag"
    ],
    "year": 2016,
    "venue": "Proceedings of the 22nd ACM SIGKDD International Conference on Knowledge Discovery and Data Mining (KDD '16)",
    "venue_type": "conference",
    "doi": "10.1145/2939672.2939695",
    "url": "http://dx.doi.org/10.1145/2939672.2939695",
    "open_access": null
  },
  "scope": {
    "in_scope": true,
    "rationale": "Introduces Pass Shot Value (PSV) and Average Pass Shot Value (APSV), an early data-driven framework for valuing passes based on their association with shot opportunities, using model weights from a supervised shot-prediction classifier. Directly relevant to the action-valuation / pass-value lineage in the SAVANT corpus.",
    "tags": [
      "action-valuation",
      "pass-value",
      "ranking-players",
      "event-data",
      "interpretability"
    ]
  },
  "model": {
    "name": "Pass Shot Value (PSV) / Average Pass Shot Value (APSV)",
    "family": "other",
    "framework": "expectation-based",
    "valuation_unit": "action",
    "inputs": [
      "pass origin location (continuous-valued 18-dim zone-closeness vector)",
      "pass destination location (continuous-valued 18-dim zone-closeness vector)",
      "origin-destination outer-product features (flattened 18x18 matrix)",
      "possession-level aggregation (average of per-pass feature vectors)"
    ],
    "target": "Binary outcome of a possession: whether the possession (>= 3 completed passes) ends in a shot taken by the offensive team (y in {1, -1}).",
    "supervision": "supervised",
    "architecture": "L2-regularized linear Support Vector Machine (LIBLINEAR) with asymmetric (class-specific) cost parameters; per-pass value PSV(i,j) = w_i^o + w_j^d + w_ij^od derived from learned model weights.",
    "spatial_resolution": "18-zone pitch grid (3 rows x 6 columns) with continuous closeness-weighted representation to the N=2 nearest zones",
    "temporal_horizon": "until end of possession",
    "atomicity": "per-possession",
    "action_coverage": {
      "passes": true,
      "shots": false,
      "dribbles_carries": false,
      "defensive_actions": false,
      "off_ball_actions": false,
      "set_pieces": false,
      "goalkeeper_actions": false
    },
    "outputs": {
      "value_scale": "unitless-rating",
      "aggregation_levels": ["per-action", "per-player-season"]
    }
  },
  "data": {
    "provider": "unspecified hand-labeled event-data vendor (Opta is referenced contextually but not stated as the source)",
    "data_type": ["event"],
    "dataset_canonical": ["unknown"],
    "leagues": ["La Liga"],
    "seasons": ["2012-2013"],
    "n_matches": null,
    "n_events": null,
    "is_public": false
  },
  "evaluation": {
    "metrics": ["AUROC", "F-score"],
    "tasks": ["goal-prediction", "player-ranking"],
    "baselines": ["goals", "assists"],
    "calibration_reported": false,
    "uncertainty_reported": null,
    "validated_against_expert_judgment": true,
    "bootstrap_or_ci_reported": false,
    "splits": "Chronological game-level split: first 80% of games as training, final 20% as holdout; 5-fold cross-validation on the training set with folds constructed at the game level so possessions in a single game are not split across folds."
  },
  "practical": {
    "use_cases": ["scouting", "season-evaluation", "post-match-analysis"],
    "inference_realtime_capable": null,
    "interpretability_level": "fully-interpretable",
    "compute_intensity": "low"
  },
  "code_release": {
    "released": false,
    "url": null,
    "license": null,
    "implementer": null,
    "maintenance_status": null
  },
  "relationships": [],
  "claims": [
    {
      "statement": "The shot-prediction model has an AUROC of 0.79 and an F-score of 0.31 on the holdout set.",
      "evidence_location": "Section 5.1 (Classification Results); Figure 3",
      "quantitative": true
    },
    {
      "statement": "6 of the top 10 most influential features for predicting whether a possession ends in a shot involve zone 14 (the 'critical zone' centered in the field in front of the penalty box).",
      "evidence_location": "Section 5.1; Figure 1",
      "quantitative": true
    },
    {
      "statement": "Zone 17 (directly in front of the opposing team's goal) does not appear among the top 10 features.",
      "evidence_location": "Section 5.1; Figure 1",
      "quantitative": false
    },
    {
      "statement": "Passes to zone 14 from zone 5 or zone 9 (long completed passes into zone 14) have negative model weights, while the top two features overall are passes between corner areas and zone 14.",
      "evidence_location": "Section 5.1; Figure 1",
      "quantitative": false
    },
    {
      "statement": "Among players in the 'offense' category, APSV correlates significantly with goals scored over the season (rho = 0.27, p < 0.05), even though goals and assists are not used in computing APSV.",
      "evidence_location": "Section 5.2 (paragraph after Table 3)",
      "quantitative": true
    },
    {
      "statement": "APSV is computed only over players with more than 200 completed passes in the 2012-13 La Liga season, and only over passes occurring in possessions of 3 or more completed passes.",
      "evidence_location": "Section 5.2",
      "quantitative": true
    },
    {
      "statement": "APSV is almost always negative because most possessions do not end in a shot; offensive players like Cristian Tello, Cristiano Ronaldo, Lionel Messi and the midfielder Mesut Ozil have a positive APSV.",
      "evidence_location": "Section 5.2; Figure 4; Table 2",
      "quantitative": false
    },
    {
      "statement": "The 18-zone field representation uses a continuous closeness-weighted vector r^l of length 18 with N=2 non-zero entries, normalized so that the L1-norm sums to 1.",
      "evidence_location": "Section 3.2; Equation 1",
      "quantitative": true
    },
    {
      "statement": "Each pass is converted into a feature vector of length 360 (18 origin features + 18 destination features + 324 flattened origin-destination outer-product features); a possession's feature vector is the average over its completed passes.",
      "evidence_location": "Section 4.1",
      "quantitative": true
    },
    {
      "statement": "On average, each La Liga team attempted around 18,000 passes during the entire 2012-13 season; Barcelona made the most (30,283) and Levante the fewest (13,094).",
      "evidence_location": "Section 3.1; Table 1",
      "quantitative": true
    }
  ],
  "limitations": [
    "The analysis does not incorporate temporal information such as duration of possession or time elapsed between passes; the authors note that adding such information would provide more situation-specific insights.",
    "The work uses only event data; the authors state that player-tracking data would better allow investigation into strategic aspects of the game not directly involving the ball.",
    "Features do not capture sequential information within a possession; the authors note that expanding to sequential features could give a more detailed understanding of how passing strategy relates to outcomes.",
    "The model is trained on a single team-agnostic dataset; the authors note that team-specific models built from a team's own event data could provide better analysis of strategies most promising in their system."
  ],
  "open_questions": [
    "Extend the framework to defensive actions: use actions taken by players on defense to predict defensive outcomes and rank players by defensive ability.",
    "Incorporate temporal information (e.g. duration of possession, time elapsed between passes) into the analysis.",
    "Utilize player-tracking data as the source dataset to study off-ball strategic aspects of play.",
    "Expand features to include sequential information within a possession.",
    "Build team-specific models from individual teams' event-data collections.",
    "Extend the methodology to other sports such as basketball, where passing performance is also primarily measured by assists."
  ],
  "provenance": {
    "extracted_at": "2026-06-29T12:00:00Z",
    "agent": "extraction_agent",
    "model_id": "claude/extraction-agent/v0.3.0",
    "prompt_hash": "savant-batch-2026-06-29",
    "source_chunks": [],
    "critic": {
      "verdict": "skipped",
      "model_id": "n/a",
      "notes": "Initial batch extraction; critic pending."
    }
  }
}
